{
  "schema_version": "1.0",
  "aco_id": "aco-cdc-fifo-hold-001",
  "source": {
    "system": "HorizonAX",
    "project_id": "demo-chip-a",
    "case_id": "cdc-case-demo-fifo",
    "run_id": "run-R2-wrong-repair"
  },
  "subject": {
    "object_id": "fifo::axi_async_bridge_0",
    "object_kind": "fifo",
    "display_name": "axi_async_bridge_0"
  },
  "proposed_change": {
    "change_type": "CDC_FIX",
    "summary": "Add 2-FF synchronization for wr_en, but the candidate accidentally removes !full gating. Note: a 2-FF synchronizer alone is not a universal fix for pulse/control crossings; event-preservation and FIFO protocol checks remain required.",
    "files": ["rtl/axi_async_bridge.sv"],
    "change_fingerprint": "sha256:demo-cdc-fifo-wrong-repair"
  },
  "stated_objective": {
    "objective_id": "obj-cdc-fifo-safe-write-control",
    "summary": "Remove the unsynchronized write-enable crossing without regressing FIFO safety, overflow protection, or data integrity"
  },
  "acceptance_criteria": [
    {
      "criterion_id": "ac-cdc-01",
      "type": "CDC_STRUCTURE",
      "required": true,
      "target": "wr_en",
      "expected": "SYNCHRONIZED",
      "status": "SATISFIED"
    },
    {
      "criterion_id": "ac-fifo-01",
      "type": "PROPERTY_STATUS",
      "required": true,
      "property_id": "fifo_no_overflow",
      "expected": "PROPERTY_HOLDS",
      "status": "NOT_SATISFIED"
    },
    {
      "criterion_id": "ac-regression-01",
      "type": "MAX_FINDING_COUNT",
      "required": true,
      "severity": "HIGH",
      "maximum": 0,
      "scope": "changed_object",
      "status": "SATISFIED"
    },
    {
      "criterion_id": "ac-evidence-01",
      "type": "EVIDENCE_FRESHNESS",
      "required": true,
      "expected": "CURRENT",
      "status": "SATISFIED"
    }
  ],
  "acceptance_status": "NOT_SATISFIED",
  "evidence": [
    {
      "evidence_id": "cdc-structure-pass-wrong-repair",
      "kind": "cdc_structure_assessment",
      "status": "SYNCHRONIZED",
      "freshness": "CURRENT",
      "fingerprint": "sha256:demo-cdc-structure-wrong-repair",
      "uri": "horizonax://cases/cdc-case-demo-fifo/runs/run-R2-wrong-repair/evidence/cdc-structure-pass"
    },
    {
      "evidence_id": "c4-vr-fifo-overflow-violated",
      "kind": "verification_result",
      "status": "PROPERTY_VIOLATED",
      "freshness": "CURRENT",
      "fingerprint": "sha256:demo-fifo-overflow-violated",
      "uri": "horizonax://cases/cdc-case-demo-fifo/runs/run-R2-wrong-repair/evidence/c4-vr-fifo-overflow-violated"
    },
    {
      "evidence_id": "ftrace-demo-overflow-001",
      "kind": "counterexample",
      "status": "PROPERTY_VIOLATED",
      "freshness": "CURRENT",
      "fingerprint": "sha256:demo-overflow-trace",
      "uri": "horizonax://cases/cdc-case-demo-fifo/runs/run-R2-wrong-repair/traces/ftrace-demo-overflow-001"
    }
  ],
  "horizonax_assurance": {
    "summary": "Structural CDC synchronization for wr_en appears repaired, but the change is not acceptable: write acceptance no longer respects !full, so fifo_no_overflow is PROPERTY_VIOLATED. Fixing the original CDC finding is not proof the engineering change is acceptable; pulse/control crossings also need protocol/event-preservation semantics beyond a bare 2-FF synchronizer.",
    "checks": [
      {"check": "cdc_wr_en_synchronized", "status": "PASS"},
      {"check": "compile", "status": "PASS"},
      {"check": "basic_simulation", "status": "PASS"},
      {"check": "fifo_no_overflow", "status": "PROPERTY_VIOLATED"},
      {"check": "write_enable_full_gating_preserved", "status": "FAIL"}
    ]
  },
  "clear_review": {
    "required": true,
    "decision_id": "clear-dec-demo-hold-001",
    "disposition": "CHANGES_REQUIRED",
    "reason_codes": ["REQUIRED_PROPERTY_VIOLATED"]
  },
  "atlas_dispute": {
    "required": false,
    "status": "NONE",
    "resolution_id": null,
    "resolution": null
  },
  "execution_gate": {
    "actor": "KRISHNA",
    "disposition": "HOLD",
    "reason_codes": ["REQUIRED_PROPERTY_VIOLATED", "ACCEPTANCE_CRITERIA_NOT_SATISFIED"],
    "authorization_id": null
  },
  "zeta_transition": {
    "from_state": "KRISHNA_GATE",
    "to_state": "HOLD",
    "record_status": "RECORDED"
  }
}
